[
  {
    "id": "core_mat_stone_granite",
    "tags": ["stone", "igneous", "hard"],
    "density_solid": 2750,
    "resists": {"bash": 70, "cut": 85, "stab": 80, "acid": 40, "fire": 75, "cold": 85, "electric": 20, "arcane": 15},
    "env": {"insulation": 15, "waterproof": 60, "breathability": 0, "chem_protect": 30},
    "struct": {"durability": 90, "rigidity": 95},
    "work": {"forgeable": false, "weldable": false, "carveable": true},
    "mana_conductivity": 25,
    "beautifulness": 60,
    "valuebaleness": 1.2,
    "thermo": {"melt_point_c": 1215}
  },
  {
    "id": "core_mat_stone_marble",
    "tags": ["stone", "metamorphic", "decorative"],
    "density_solid": 2700,
    "resists": {"bash": 65, "cut": 75, "stab": 70, "acid": 20, "fire": 70, "cold": 80, "electric": 15, "arcane": 20},
    "env": {"insulation": 12, "waterproof": 55, "breathability": 0, "chem_protect": 20},
    "struct": {"durability": 80, "rigidity": 85},
    "work": {"forgeable": false, "weldable": false, "carveable": true},
    "mana_conductivity": 30,
    "beautifulness": 85,
    "valuebaleness": 2.5,
    "thermo": {"melt_point_c": 1200}
  },
  {
    "id": "core_mat_stone_basalt",
    "tags": ["stone", "volcanic", "dark"],
    "density_solid": 3000,
    "resists": {"bash": 75, "cut": 80, "stab": 75, "acid": 50, "fire": 90, "cold": 85, "electric": 10, "arcane": 10},
    "env": {"insulation": 20, "waterproof": 65, "breathability": 0, "chem_protect": 35},
    "struct": {"durability": 85, "rigidity": 90},
    "work": {"forgeable": false, "weldable": false, "carveable": true},
    "mana_conductivity": 15,
    "beautifulness": 45,
    "valuebaleness": 0.9,
    "thermo": {"melt_point_c": 1260}
  },
  {
    "id": "core_mat_stone_sandstone",
    "tags": ["stone", "sedimentary", "soft"],
    "density_solid": 2300,
    "resists": {"bash": 50, "cut": 60, "stab": 55, "acid": 25, "fire": 60, "cold": 70, "electric": 25, "arcane": 25},
    "env": {"insulation": 10, "waterproof": 40, "breathability": 5, "chem_protect": 15},
    "struct": {"durability": 65, "rigidity": 70},
    "work": {"forgeable": false, "weldable": false, "carveable": true},
    "mana_conductivity": 35,
    "beautifulness": 50,
    "valuebaleness": 0.8,
    "thermo": {"melt_point_c": 1100}
  },
  {
    "id": "core_mat_stone_limestone",
    "tags": ["stone", "sedimentary", "common"],
    "density_solid": 2500,
    "resists": {"bash": 55, "cut": 65, "stab": 60, "acid": 15, "fire": 65, "cold": 75, "electric": 20, "arcane": 30},
    "env": {"insulation": 12, "waterproof": 45, "breathability": 2, "chem_protect": 10},
    "struct": {"durability": 70, "rigidity": 75},
    "work": {"forgeable": false, "weldable": false, "carveable": true},
    "mana_conductivity": 40,
    "beautifulness": 55,
    "valuebaleness": 1.0,
    "thermo": {"melt_point_c": 1150}
  },
  {
    "id": "core_mat_stone_shale",
    "tags": ["stone", "sedimentary", "layered"],
    "density_solid": 2400,
    "resists": {"bash": 45, "cut": 55, "stab": 50, "acid": 30, "fire": 55, "cold": 65, "electric": 30, "arcane": 35},
    "env": {"insulation": 8, "waterproof": 35, "breathability": 8, "chem_protect": 12},
    "struct": {"durability": 55, "rigidity": 60},
    "work": {"forgeable": false, "weldable": false, "carveable": true},
    "mana_conductivity": 45,
    "beautifulness": 40,
    "valuebaleness": 0.7,
    "thermo": {"melt_point_c": 1050}
  },
  {
    "id": "core_mat_soil_dirt",
    "tags": ["soil", "organic", "soft"],
    "density_solid": 1600,
    "resists": {"bash": 10, "cut": 5, "stab": 3, "acid": 5, "fire": 10, "cold": 20, "electric": 50, "arcane": 60},
    "env": {"insulation": 25, "waterproof": 5, "breathability": 70, "chem_protect": 2},
    "struct": {"durability": 15, "rigidity": 5},
    "work": {"forgeable": false, "weldable": false, "carveable": false},
    "mana_conductivity": 70,
    "beautifulness": 10,
    "valuebaleness": 0.1,
    "thermo": {}
  },
  {
    "id": "core_mat_soil_grass",
    "tags": ["soil", "organic", "vegetation"],
    "density_solid": 1500,
    "resists": {"bash": 12, "cut": 8, "stab": 5, "acid": 8, "fire": 5, "cold": 25, "electric": 45, "arcane": 65},
    "env": {"insulation": 30, "waterproof": 8, "breathability": 80, "chem_protect": 3},
    "struct": {"durability": 20, "rigidity": 8},
    "work": {"forgeable": false, "weldable": false, "carveable": false},
    "mana_conductivity": 75,
    "beautifulness": 25,
    "valuebaleness": 0.2,
    "thermo": {"ignition_point_c": 300}
  },
  {
    "id": "core_mat_soil_sand",
    "tags": ["soil", "granular", "loose"],
    "density_solid": 1700,
    "resists": {"bash": 8, "cut": 3, "stab": 2, "acid": 50, "fire": 40, "cold": 30, "electric": 60, "arcane": 40},
    "env": {"insulation": 20, "waterproof": 2, "breathability": 90, "chem_protect": 5},
    "struct": {"durability": 10, "rigidity": 2},
    "work": {"forgeable": false, "weldable": false, "carveable": false},
    "mana_conductivity": 50,
    "beautifulness": 15,
    "valuebaleness": 0.1,
    "thermo": {"melt_point_c": 1700}
  },
  {
    "id": "core_mat_soil_mud",
    "tags": ["soil", "wet", "soft"],
    "density_solid": 1800,
    "resists": {"bash": 5, "cut": 2, "stab": 1, "acid": 10, "fire": 20, "cold": 15, "electric": 30, "arcane": 70},
    "env": {"insulation": 15, "waterproof": 0, "breathability": 50, "chem_protect": 1},
    "struct": {"durability": 8, "rigidity": 1},
    "work": {"forgeable": false, "weldable": false, "carveable": false},
    "mana_conductivity": 80,
    "beautifulness": 5,
    "valuebaleness": 0.05,
    "thermo": {}
  },
  {
    "id": "core_mat_snow",
    "tags": ["frozen", "water", "cold"],
    "density_solid": 500,
    "resists": {"bash": 3, "cut": 2, "stab": 1, "acid": 80, "fire": 0, "cold": 100, "electric": 70, "arcane": 50},
    "env": {"insulation": 50, "waterproof": 10, "breathability": 60, "chem_protect": 0},
    "struct": {"durability": 5, "rigidity": 3},
    "work": {"forgeable": false, "weldable": false, "carveable": false},
    "mana_conductivity": 60,
    "beautifulness": 30,
    "valuebaleness": 0.01,
    "thermo": {"melt_point_c": 0}
  },
  {
    "id": "core_mat_ore_iron",
    "tags": ["ore", "metal", "valuable"],
    "density_solid": 5000,
    "resists": {"bash": 60, "cut": 70, "stab": 65, "acid": 25, "fire": 65, "cold": 75, "electric": 20, "arcane": 25},
    "env": {"insulation": 8, "waterproof": 50, "breathability": 0, "chem_protect": 20},
    "struct": {"durability": 75, "rigidity": 80},
    "work": {"forgeable": true, "weldable": false, "carveable": false},
    "mana_conductivity": 30,
    "beautifulness": 35,
    "valuebaleness": 3.0,
    "thermo": {"melt_point_c": 1538}
  },
  {
    "id": "core_mat_ore_gold",
    "tags": ["ore", "precious", "valuable"],
    "density_solid": 19300,
    "resists": {"bash": 45, "cut": 50, "stab": 45, "acid": 90, "fire": 70, "cold": 80, "electric": 5, "arcane": 40},
    "env": {"insulation": 5, "waterproof": 60, "breathability": 0, "chem_protect": 50},
    "struct": {"durability": 50, "rigidity": 40},
    "work": {"forgeable": true, "weldable": true, "carveable": false},
    "mana_conductivity": 20,
    "beautifulness": 95,
    "valuebaleness": 50.0,
    "thermo": {"melt_point_c": 1064}
  },
  {
    "id": "core_mat_air",
    "tags": ["gas", "empty"],
    "density_solid": 1,
    "resists": {"bash": 0, "cut": 0, "stab": 0, "acid": 0, "fire": 0, "cold": 0, "electric": 0, "arcane": 0},
    "env": {"insulation": 0, "waterproof": 0, "breathability": 100, "chem_protect": 0},
    "struct": {"durability": 0, "rigidity": 0},
    "work": {"forgeable": false, "weldable": false, "carveable": false},
    "mana_conductivity": 100,
    "beautifulness": 0,
    "valuebaleness": 0,
    "thermo": {}
  }
]